{"authority":"production-phase-state","completed_at":"2026-10-02T01:40:58Z","control":{"change_schema_sha256":"5b54dcb568f88a3df63f1203b5347419257aa677de82d73efb7bcaaf2d8c41c6","release_policy_sha256":"c14a852c0f852d476ff38028b057defae64824631b6b8a7cae09ad1f471bee86","run_attempt":1,"run_id":"36951942755","runner_environment":"github-hosted","workflow_path":".github/workflows/verify-production-crm-canary.yml","workflow_sha":"02231089dc72476fe36c313ce6d4a9256204cdc5"},"evidence":{"canary_sha256":"19984c22139a420de087f30de03ddf5283694d989a5489fc85e621401852f32a","change_receipt_sha256":"7e5d67f96395af4f5b5b4297e5c01addbc3107877b1ed817520d00bc972cdabd","production_plan_sha256":"4ad44955059326db7b4452b4fda335d6bbadaa02cdbde018a4f2b9ce2ffb8a0e","recovery_sha256":"55d5f7cf91672abfa7a5c2162143d23cd0afe3b8532f9f46679f3b3e7b209a4f","rollout_plan_sha256":"fb146566bcd4595937624282d2e4f510879e0b937e9cbae5a61e4be7db7fcaee"},"gates":{"canary_succeeded":true,"deployment_succeeded":true,"migration_succeeded":true},"lineage":{"event_sequence":1,"from":"genesis","operation":"activate","phase":"ui","phase_ordinal":4,"phase_source_sha":"6f25ea1919ee28856dee59d5fd121671214087e3","predecessor_kind":"apply-receipt","predecessor_state_sha256":"7e5d67f96395af4f5b5b4297e5c01addbc3107877b1ed817520d00bc972cdabd","to":"ui"},"provider_state":{"active_deployment_identity_sha256":"b95ce75e0302452e44b29812de5d54549d2dbf33d43d77359013eb7c1da53818","app_identity_sha256":"c8c3b97aa3face41a6c2d1357807fa979e8a9bf2db25fff3f31b98dfa2019a31","app_updated_at_sha256":"642046f4a5bca76fb994ef34125f6139d9f289def40daa96e32fe9bd2e80f893","canonical_spec_sha256":"9b6e8bd6f1c1ac451d4e2e8f3583d8d6ae3af11a60e1cf0f60182d951ad96011","default_ingress_sha256":"05ab4f90194ad37c6926138e9aafbd49c73aa75d08da92b0b1309bfce207cfa8","environment_values_sha256":"e4a9eb41e54a256b2b9c8b008354d730147a4229f5aa06c7625970cd9b7db3e8","images":[{"component":"web","digest":"sha256:7a4a186cfbb657d62bb1afc3c3c3c862d907a70aa6c82a1f510af8569fea6e23","repository":"ghcr.io/medtechcorps-netizen/rereply-release-web","subject":"ghcr.io/medtechcorps-netizen/rereply-release-web@sha256:7a4a186cfbb657d62bb1afc3c3c3c862d907a70aa6c82a1f510af8569fea6e23"},{"component":"meta-relay","digest":"sha256:400d21f6b7dedd6b3b174aaa7f1b9e77ac8c5a7d8c4004803aa649966528808f","repository":"ghcr.io/medtechcorps-netizen/rereply-release-meta-relay","subject":"ghcr.io/medtechcorps-netizen/rereply-release-meta-relay@sha256:400d21f6b7dedd6b3b174aaa7f1b9e77ac8c5a7d8c4004803aa649966528808f"},{"component":"gmail-relay","digest":"sha256:4a975aaf0cab069dfb96c02888f66df49c2e916ca399fc9faba74109fcd4540a","repository":"ghcr.io/medtechcorps-netizen/rereply-release-gmail-relay","subject":"ghcr.io/medtechcorps-netizen/rereply-release-gmail-relay@sha256:4a975aaf0cab069dfb96c02888f66df49c2e916ca399fc9faba74109fcd4540a"}],"non_source_projection_sha256":"d70b6908503707d8070a7d26524d495ba630e141c40466169dba24ab4e352701","source_mode":"digest-images"},"repository":"medtechcorps-netizen/whatomate","rollback":{"allowed_targets":["backend","bridge"],"forbidden_targets":["baseline"]},"schema_version":1}
